{
  "name": "Sustained memory pressure",
  "targetKind": "fleet",
  "kind": "numeric",
  "severity": "warning",
  "enabled": true,
  "condition": {
    "metric": "memory.used_percent",
    "operator": "gt",
    "triggerValue": 90,
    "clearValue": 85,
    "triggerSeconds": 300,
    "clearSeconds": 120
  }
}
